{
  "$schema": "http://json-schema.org/draft-07/schema#",
  "title": "ai-dev-kit project adapter",
  "description": "Per-project parameters read by ai-dev-kit skills at run time. Every field is optional — a skill missing a field derives it from the repo (and says so) rather than failing.",
  "type": "object",
  "additionalProperties": false,
  "properties": {
    "project": {
      "type": "string",
      "description": "Project name (informational)."
    },
    "projectType": {
      "type": "string",
      "enum": [
        "web-app",
        "api-service",
        "cli",
        "library",
        "game",
        "data",
        "mobile",
        "desktop",
        "other"
      ],
      "description": "Dispatches skills' per-domain reference procedures (e.g. live-verify reads references/<type>.md). Absent → skills infer the type from the repo (manifests, engine project files) and say so."
    },
    "ecosystem": {
      "type": "object",
      "additionalProperties": false,
      "description": "Language/registry facts dep-check and friends read. Supersedes packageManager for non-JS projects; both may coexist.",
      "properties": {
        "runtime": {
          "type": "string",
          "description": "Primary runtime/toolchain, free string: node · python · rust · go · dotnet · jvm · unity · unreal · godot · …"
        },
        "manifestFiles": {
          "type": "array",
          "items": { "type": "string" },
          "description": "Dependency manifests to watch (package.json, pyproject.toml, Cargo.toml, go.mod, *.csproj, packages.config, …)."
        },
        "registryQuery": {
          "type": "string",
          "description": "Command template printing published versions/dates for {pkg} (e.g. `npm view {pkg} versions --json`, `pip index versions {pkg}`, `cargo search {pkg} --limit 1`)."
        },
        "addCommand": {
          "type": "string",
          "description": "Command template adding {pkg} at {version} per the project's package manager."
        }
      }
    },
    "packageManager": {
      "type": "string",
      "enum": ["pnpm", "npm", "yarn", "bun"],
      "description": "v1 (JS-only) — prefer `ecosystem.*` for new adapters; still honored. Shapes registry queries and script invocations."
    },
    "gate": {
      "type": "array",
      "items": { "type": "string" },
      "description": "Commands, run in order, that make up the full verification gate (lint, type-check, build). An array — never a '&&' chain — so it runs on any shell."
    },
    "test": {
      "type": "object",
      "additionalProperties": false,
      "properties": {
        "unit": { "type": "string" },
        "e2e": { "type": "string" }
      }
    },
    "verify": {
      "type": "object",
      "additionalProperties": false,
      "description": "How live-verify runs the built artifact and observes it — any project shape (server, game, CLI, library, pipeline). Supersedes prodVerify (still honored; skills read verify first and fall back).",
      "properties": {
        "build": {
          "type": "string",
          "description": "Produces a fresh production-shaped build/artifact."
        },
        "run": {
          "type": "string",
          "description": "Runs the artifact: serve on the dedicated port, headless engine scene, CLI invocation, consumer-harness import, sample pipeline slice."
        },
        "ready": {
          "type": "object",
          "additionalProperties": false,
          "description": "How the skill knows the run is up / done and healthy.",
          "properties": {
            "kind": {
              "type": "string",
              "enum": ["http", "tcp-port", "exit-code", "log-line", "file-exists", "manual"]
            },
            "port": { "type": "integer", "description": "For http/tcp-port: the dedicated verify port (never the dev port)." },
            "url": { "type": "string", "description": "For http: the readiness URL." },
            "pattern": { "type": "string", "description": "For log-line: the readiness/success pattern." },
            "path": { "type": "string", "description": "For file-exists: the artifact/output path." }
          }
        },
        "observe": {
          "type": "array",
          "items": { "type": "string" },
          "description": "Commands or flow descriptions that exercise changed behavior and produce observable output (curl the endpoint, run the golden-output case, load the test scene)."
        },
        "notes": {
          "type": "string",
          "description": "Env/origin/seed facts an agent needs before driving flows."
        }
      }
    },
    "prodVerify": {
      "type": "object",
      "additionalProperties": false,
      "description": "v1 (server-shaped) — prefer `verify` for new adapters; still honored as the fallback. How live-verify serves a production build without disturbing a standing dev server.",
      "properties": {
        "build": {
          "type": "string",
          "description": "Produces a fresh production build."
        },
        "start": {
          "type": "string",
          "description": "Serves the production build on the dedicated port."
        },
        "port": {
          "type": "integer",
          "description": "Dedicated prod-verify port (never the dev port)."
        },
        "notes": {
          "type": "string",
          "description": "Env/origin facts an agent needs before driving flows."
        }
      }
    },
    "cache": {
      "type": "object",
      "additionalProperties": false,
      "description": "The local build cache that grows without bound, and how to measure/prune it.",
      "properties": {
        "size": { "type": "string" },
        "prune": { "type": "string" }
      }
    },
    "docs": {
      "type": "object",
      "additionalProperties": false,
      "properties": {
        "dir": { "type": "string" },
        "status": {
          "type": "string",
          "description": "The read-first-on-resume status/handoff doc."
        },
        "backlog": { "type": "string" },
        "backlogHuman": {
          "type": "string",
          "description": "Optional second backlog for human-blocked rows (needs a verdict, hardware, or account only the user has). Pairs with `backlog` (the agent-continuable track) — projects running the dual-track split keep 'never both blocked at once' as the working rule."
        },
        "contextDir": {
          "type": "string",
          "description": "Agent context docs, loaded on demand."
        },
        "archiveDir": {
          "type": "string",
          "description": "Where audit reports and archived history land."
        },
        "handoff": {
          "type": "string",
          "description": "Where checkpoint writes the resume/handoff file. Absent → the agent memory directory (resume-prompt.md). Keep repo paths out of version control unless deliberately tracked."
        }
      }
    },
    "contextBudget": {
      "type": "object",
      "additionalProperties": false,
      "description": "Line/token budgets for the always-loaded and on-demand context surfaces, read by doc-audit's standing-instruction hunt. Heuristics — the audit flags and recommends, never hard-fails.",
      "properties": {
        "agentsMdMaxLines": {
          "type": "integer",
          "description": "Ceiling for the agent-onboarding file (default 150)."
        },
        "contextDocSplitTokens": {
          "type": "integer",
          "description": "A context doc above this size (tokens ≈ chars/4) is flagged for split/index (default 3000)."
        },
        "memoryIndexMaxTokens": {
          "type": "integer",
          "description": "Ceiling for the always-loaded memory index (default 700)."
        },
        "memoryFileMaxTokens": {
          "type": "integer",
          "description": "Per-memory-file ceiling (default 1500)."
        },
        "skillDescriptionMaxTokens": {
          "type": "integer",
          "description": "Combined ceiling for all always-loaded skill descriptions (frontmatter `description:` lines load every session). doc-audit flags when the installed set exceeds it."
        }
      }
    },
    "enforcement": {
      "type": "object",
      "additionalProperties": false,
      "description": "Opt-in blocking or asking hooks. The handlers ship (and may be wired) with every install but each no-ops unless its key is set here — absent key = advise-only kit behavior, unchanged.",
      "properties": {
        "stopGate": {
          "type": "object",
          "additionalProperties": false,
          "description": "Stop-hook gate: the session may not end with these commands failing (exit 2 feeds failures back). Loop-guarded via stop_hook_active; skips before dependencies are installed.",
          "properties": {
            "commands": {
              "type": "array",
              "items": { "type": "string" },
              "description": "Commands run in order at session end (e.g. a fast typecheck + unit-test pair — keep it under ~2 minutes)."
            },
            "timeoutSeconds": {
              "type": "integer",
              "description": "Per-command timeout (default 150)."
            }
          }
        },
        "bannedApis": {
          "type": "array",
          "description": "Path-scoped banned-pattern guards (the determinism-guard pattern generalized): each entry blocks listed regex patterns from entering files under its paths.",
          "items": {
            "type": "object",
            "additionalProperties": false,
            "properties": {
              "name": { "type": "string", "description": "Label used in the block message." },
              "paths": {
                "type": "array",
                "items": { "type": "string" },
                "description": "Repo-relative directory prefixes the guard watches."
              },
              "excludePaths": {
                "type": "array",
                "items": { "type": "string" },
                "description": "Repo-relative files/prefixes exempt from the guard."
              },
              "extensions": {
                "type": "array",
                "items": { "type": "string" },
                "description": "File extensions guarded (default ['.ts', '.tsx', '.js', '.mjs'])."
              },
              "rules": {
                "type": "array",
                "items": {
                  "type": "object",
                  "additionalProperties": false,
                  "properties": {
                    "pattern": { "type": "string", "description": "JS regex source matched per line (comments stripped first)." },
                    "why": { "type": "string", "description": "Shown in the block message — what to use instead." }
                  },
                  "required": ["pattern", "why"]
                }
              },
              "docs": { "type": "string", "description": "Doc path cited in the block message." }
            },
            "required": ["paths", "rules"]
          }
        },
        "checkpointAutorun": {
          "type": "boolean",
          "description": "true = the Stop hook nudges one autonomous checkpoint turn when the tree is dirty or unpushed at session end (skips mid-rebase/merge and pending-question stops)."
        },
        "scriptExecGuard": {
          "type": "boolean",
          "description": "true = before a Bash/PowerShell command executes a session-fresh script (untracked, outside any repo, or uncommitted lines) or inline code (node -e, python -c, pwsh -Command), the PreToolUse hook scans it for a recursive delete of a non-literal or critical target and answers permissionDecision \"ask\" — the human decides. Never denies, never exits 2; tracked-clean scripts are skipped. Safe to pre-set in a template: it can only add a permission prompt."
        }
      }
    },
    "commit": {
      "type": "object",
      "additionalProperties": false,
      "properties": {
        "style": { "type": "string" },
        "trailers": {
          "type": "boolean",
          "description": "false = never add Co-Authored-By or other trailers."
        },
        "useFileFlag": {
          "type": "boolean",
          "description": "true = write the message to a file and use git commit -F (survives PowerShell 5.1 quoting)."
        }
      }
    },
    "ci": {
      "type": "object",
      "additionalProperties": false,
      "properties": {
        "provider": {
          "type": "string",
          "enum": [
            "github-actions",
            "gitlab-ci",
            "azure-devops",
            "jenkins",
            "circleci",
            "other"
          ]
        },
        "workflow": {
          "type": "string",
          "description": "The workflow to watch to green at a session-ending checkpoint."
        }
      }
    },
    "hygiene": {
      "type": "object",
      "additionalProperties": false,
      "properties": {
        "devPorts": {
          "type": "array",
          "items": { "type": "integer" },
          "description": "Ports where orphaned dev/prod servers may linger."
        },
        "e2eUserPattern": {
          "type": "string",
          "description": "Email pattern identifying throwaway e2e users in the local DB."
        },
        "keepContainers": {
          "type": "array",
          "items": { "type": "string" },
          "description": "Docker containers tidy must never prune."
        }
      }
    },
    "depPolicy": {
      "type": "object",
      "additionalProperties": false,
      "properties": {
        "releaseAgeDays": {
          "type": "integer",
          "description": "Prefer the newest version at least this many days old."
        },
        "exactPin": {
          "type": "array",
          "items": { "type": "string" },
          "description": "Packages that publish frequently — always pin exact."
        }
      }
    },
    "harnessAudit": {
      "type": "object",
      "additionalProperties": false,
      "description": "Parameters read by the harness-audit skill.",
      "properties": {
        "kitSourcePath": {
          "type": "string",
          "description": "Local clone of ai-dev-kit to mirror harness-audit's sources.md/stack.md repairs into, if this machine has one."
        }
      }
    },
    "init": {
      "type": "object",
      "additionalProperties": false,
      "description": "Project-inception parameters read by the project-init (greenfield) and project-adopt (brownfield) skills.",
      "properties": {
        "scaffold": {
          "type": "string",
          "description": "Mechanical scaffold command run at intake (env seed, rename, template-doc slim). `{name}` is replaced with a lowercase npm-safe slug of the chosen app name (scaffolds may silently skip renaming on an invalid npm name); omit the placeholder if the command takes none. Both inception skills confirm before running any scaffold that removes files."
        },
        "productBrief": {
          "type": "string",
          "description": "Where the converged product brief lands (default docs/PRODUCT.md)."
        },
        "migrationMap": {
          "type": "string",
          "description": "Where project-adopt's migration map lands — disposition table, parity contract, data/user plan (default docs/MIGRATION.md)."
        },
        "sourceDir": {
          "type": "string",
          "description": "Drop-dir convention where an existing codebase is placed for project-adopt when no path/URL argument is given (default intake/source/). Kept gitignored — the original source is a read-only reference, never committed to the adopting repo's history."
        }
      }
    }
  }
}
