{
  "project": "ai-dev-kit",
  "gate": [
    "node install.mjs --check",
    "node .github/skill-lint.mjs",
    "node .github/smoke-hooks.mjs",
    "node .github/smoke-installer.mjs",
    "node .github/check-version.mjs"
  ],
  "docs": {
    "dir": "docs",
    "status": "README.md",
    "backlog": "docs/BACKLOG.md",
    "archiveDir": "docs/archive"
  },
  "commit": {
    "style": "conventional subject + prose body (what/why + verification note)",
    "trailers": true,
    "useFileFlag": true
  },
  "ci": {
    "provider": "github-actions",
    "workflow": "CI"
  }
}
